{
  "product_id": null,
  "working_name": "Crochet Flower Bouquet Pattern Bundle",
  "product_type": "crochet pattern bundle",
  "concept": "A premium digital collection of 33 base crochet flower and bouquet patterns (roses, daisies, sunflowers, tulips, lavender, wildflowers, fillers, leaves and stems) that combine into complete bouquets. US crochet terms.",
  "audience": null,
  "season": null,
  "themes": [
    "crochet flowers",
    "flower bouquets",
    "roses",
    "sunflowers",
    "daisies",
    "lavender",
    "wildflowers",
    "floral stems",
    "leaves",
    "handmade gifts"
  ],
  "format": "crochet pattern bundle",
  "page_count": null,
  "owner_notes": "Owner request 2026-09-29 (Prompt 3). 33 genuine base patterns; colour, size and arrangement variations are not counted.",
  "candidate_keywords": [],
  "status": "draft",
  "audiences": [
    "adults",
    "beginners",
    "intermediate crocheters",
    "handmade gift makers"
  ],
  "delivery": [
    "digital",
    "printable"
  ],
  "formats": [
    "crochet pattern bundle"
  ],
  "styles": [
    "romantic",
    "botanical",
    "cottagecore",
    "premium handmade",
    "soft pastel"
  ],
  "item_count": 33
}
